{
  "$schema": "https://json-schema.org/draft/2020-12/schema",
  "type": "object",
  "additionalProperties": false,
  "required": ["schema_version", "precedence", "ambiguity_policy", "package_health_policy", "rules"],
  "properties": {
    "schema_version": {"const": 1},
    "precedence": {"type": "array", "minItems": 3, "items": {"enum": ["canonical-id", "alias", "intent", "context"]}},
    "ambiguity_policy": {"enum": ["ask-with-candidates"]},
    "package_health_policy": {"enum": ["last-known-good", "fail-closed"]},
    "rules": {
      "type": "array",
      "items": {
        "type": "object",
        "additionalProperties": false,
        "required": ["command", "intents"],
        "properties": {
          "command": {"type": "string"},
          "subcommand": {"type": "string", "pattern": "^[a-z]+(?:-[a-z]+)*$"},
          "intents": {"type": "array", "minItems": 1, "items": {"type": "string"}},
          "requires_context": {"type": "array", "items": {"type": "string"}}
        }
      }
    }
  }
}
